{
  "format": "homestead-planner",
  "version": 31,
  "assetMode": "catalog",
  "map": {
    "blockSize": 16,
    "rows": [
      [
        6,
        12
      ],
      [
        5,
        12
      ],
      [
        5,
        13
      ],
      [
        5,
        14
      ],
      [
        5,
        14
      ],
      [
        5,
        13
      ],
      [
        5,
        12
      ],
      [
        4,
        11
      ],
      [
        0,
        10
      ],
      [
        0,
        9
      ],
      [
        0,
        8
      ],
      [
        0,
        7
      ]
    ]
  },
  "assetOverrides": [],
  "placed": []
}
